{
  "id": "scada-opcua-line",
  "version": "1",
  "domain": "scada",
  "title": "SCADA OPC UA production line",
  "description": "OPC UA line devices with overview dashboard.",
  "prompt": "Provision SCADA OPC UA production line with throughput mimic and historian trends.",
  "playbook": "AgentSolutionGeneratorPlaybook",
  "acceptance": {
    "requiredTools": ["create_virtual_device", "save_mimic_diagram", "configure_variable_history"]
  }
}
