{
  "id": "mes-oee-reference",
  "version": "1",
  "domain": "mes",
  "lane": "agent",
  "title": "MES OEE reference deploy (UI verify)",
  "description": "OEE walkthrough bundle.",
  "prompt": "Install mes-oee-reference and open OEE operator screens.",
  "uiJourney": "Solutions → Deploy → Operator",
  "humanSteps": [
    "Deploy mes-oee-reference.",
    "Open Operator OEE screens."
  ],
  "playbook": "applicationLifecycleGuide",
  "bundle": {
    "appId": "mes-oee-reference",
    "manifestPath": "examples/mes-oee-reference/bundle.json"
  },
  "acceptance": {
    "validateBundle": true,
    "requiredTools": [
      "validate_bundle",
      "dry_run_deploy",
      "import_package"
    ],
    "operatorSurfaces": [
      "solutions",
      "operator"
    ]
  }
}
